"Olfactory-Enhanced VR: What's the Difference in Brain Activation Compared to Traditional VR for Emotion Induction?","X. Zhong; W. Liu; J. Xie; Y. Gu; G. Liu","School of Electronic and Information Engineering, Southwest China University, Chongqing, China; School of Electronic and Information Engineering, Southwest China University, Chongqing, China; School of Electronic and Information Engineering, Southwest China University, Chongqing, China; School of Electronic and Information Engineering, Southwest China University, Chongqing, China; School of Electronic and Information Engineering, Southwest China University, Chongqing, China",IEEE Transactions on Affective Computing,"5 Sep 2024","2024","15","3","1331","1342","Olfactory-enhanced virtual reality (OVR) creates a complex and rich emotional experience, thus promoting a new generation of human-computer interaction experiences in real-world scenarios. However, with the rise of virtual reality (VR) as a mood induction procedure (MIP), few studies have incorporated olfactory stimuli into emotion induction in three-dimensional (3D) environments. Considering the differences in electroencephalography (EEG) dynamics between sensory stimuli, all previous two-dimensional (2D) and 3D emotional studies have been less effective in reality because they only use visual and audio senses. To overcome these limitations, we developed a novel EEG signal dataset based on OVR. We systematically analyzed the influence of olfactory stimuli on emotion induction in a VR environment from a neurophysiological perspective. Specifically, synchronous EEG signals were collected from 65 participants as they watched positive and negative videos in traditional VR and OVR. Their power spectral densities (PSDs) were then calculated to compare the differences in brain activation between their VR and OVR modes during the induction of positive and negative emotions, while their brain states were classified after feature selection. The results showed that olfactory stimuli enhanced EEG responses for positive emotions, but the opposite was true for negative emotions. Additionally, the recognition rate of brain emotional states was more than 90% under both positive and negative emotions, while the high-frequency β and γ bands could effectively distinguish VR and OVR modes. This study introduced the olfaction into the field of human-computer interaction, which could promote research on emotion induction and recognition in real-world environments.","1949-3045","","10.1109/TAFFC.2023.3337745","National Natural Science Foundation of China(grant numbers:61872301,61472330); ","https://ieeexplore.ieee.org/stamp/stamp.jsp?arnumber=10335641","Electroencephalography (EEG);emotion induction;olfactory;olfactory-enhanced virtual reality","Olfactory;Electroencephalography;Virtual reality;Videos;Three-dimensional displays;Brain;Limbic system","","2","","47","IEEE","29 Nov 2023","","","IEEE","IEEE Journals"
"Automatic recognition of pleasant content of odours through ElectroEncephaloGraphic activity analysis","A. Lanata; A. Guidi; A. Greco; G. Valenza; F. Di Francesco; E. P. Scilingo","Department of Information Engineering and Research Center “E. Piaggio”, University of Pisa, Pisa, Italy; Department of Information Engineering and Research Center “E. Piaggio”, University of Pisa, Pisa, Italy; Department of Information Engineering and Research Center “E. Piaggio”, University of Pisa, Pisa, Italy; Department of Information Engineering and Research Center “E. Piaggio”, University of Pisa, Pisa, Italy; Department of Chemistry and Industrial Chem- istry, University of Pisa, Pisa, Italy; Department of Information Engineering and Research Center “E. Piaggio”, University of Pisa, Pisa, Italy",2016 38th Annual International Conference of the IEEE Engineering in Medicine and Biology Society (EMBC),"18 Oct 2016","2016","","","4519","4522","This study presents a machine learning approach applied to ElectroEnchephaloGraphic (EEG) response in a group of subjects when exposed to a controlled olfactory stimulation experiment. In the literature, in fact, there are controversial results on EEG response to odorants. This study proposes a robust leave-one-subject-out classification method to recognize features extracted from EEG signals belonging to pleasant or unpleasant olfactory stimulation classes. An accuracy of 75% has been achieved in a group of 32 subjects. Moreover a set of features extracted from lateral electrodes emphasized that right and left hemispheres behave differently when the subjects are exposed to pleasant or unpleasant odours stimuli.","1558-4615","978-1-4577-0220-4","10.1109/EMBC.2016.7591732","","https://ieeexplore.ieee.org/stamp/stamp.jsp?arnumber=7591732","","Olfactory;Electroencephalography;Feature extraction;Electrodes;Protocols;Statistical analysis;Training","Adult;Data Accuracy;Electroencephalography;Female;Humans;Machine Learning;Odorants;Olfactory Perception;Young Adult","13","","34","IEEE","18 Oct 2016","","","IEEE","IEEE Conferences"
"Non-linear EEG features for odor pleasantness recognition","E. Kroupi; D. Sopic; T. Ebrahimi","Multimedia Signal Processing Group (MMSPG), École Polytechnique Fédérale de Lausanne (EPFL), Lausanne, Switzerland; Multimedia Signal Processing Group (MMSPG), École Polytechnique Fédérale de Lausanne (EPFL), Lausanne, Switzerland; Multimedia Signal Processing Group (MMSPG), École Polytechnique Fédérale de Lausanne (EPFL), Lausanne, Switzerland",2014 Sixth International Workshop on Quality of Multimedia Experience (QoMEX),"15 Dec 2014","2014","","","147","152","Since olfactory sense is gaining ground in multimedia applications, it is important to understand the way odor pleasantness is perceived. Although several studies have explored the way odor pleasantness perception influences the power spectral density of the electroencephalography (EEG) in various brain regions, there are still no studies that investigate the way odor pleasantness perception affects the non-linear temporal variations of EEG. In this study two non-linear metrics are used, namely permutation entropy, and dimension of minimal covers, to explore the possibility of recognizing odor pleasantness perception from the non-linear properties of EEG signals. The results reveal that it is possible to discriminate between pleasant and unpleasant odors from the EEG nonlinear properties, using a Linear Discriminant Analysis classifier with cross-validation.","","978-1-4799-6536-6","10.1109/QoMEX.2014.6982311","","https://ieeexplore.ieee.org/stamp/stamp.jsp?arnumber=6982311","non-linear EEG;odor pleasantness;EEG classification;permutation entropy;minimal cover","Electroencephalography;Entropy;Multimedia communication;Scalp;Conferences;Olfactory","","4","","24","IEEE","15 Dec 2014","","","IEEE","IEEE Conferences"
"Classification of electroencephalography signals recorded during smelling of valerian and rosewater odors","Ö. Aydemir","Dep. of Electrical and Electronics Engineering, Karadeniz Technical University, Trabzon, Turkey",2016 39th International Conference on Telecommunications and Signal Processing (TSP),"1 Dec 2016","2016","","","392","395","The human brain, which receives input from the sensory organs and sends output to the muscles, is the command center of the nervous system. There are various kinds of brain monitoring techniques including computed tomography, magnetic resonance imaging (MRI), positron emission tomography, functional MRI, electroencephalography (EEG) and magnetoencephalography. Among those of techniques EEG is the most widely used one due to its portability, low set-up cost and noninvasiveness. In this work, the EEG signals, which were recorded during smelling of valerian and rosewater odors, were analyzed and classified based on features which were extracted using Fast Fourier Transform. EEG signals were taken from 5 healthy subjects in the conditions of eyes open and eyes closed at Swiss Federal Institute of Technology. We achieved a mean classification accuracy rate of 90.73 % for the subjects at eyes closed condition and a mean classification accuracy rate of 92.21 % for the subjects at eyes open condition using k-nearest neighbor algorithm. The reached results prove that the proposed method have great potential for classifying the EEG signals recorded during smelling of valerian and rosewater odors and instead of using subject-specific model it can be generalized and applied to all subjects.","","978-1-5090-1288-6","10.1109/TSP.2016.7760904","","https://ieeexplore.ieee.org/stamp/stamp.jsp?arnumber=7760904","electroencephalogram;brain response;odor;valerian;rosewater;classification;Fast Fourier Transform;feature extraction","Electroencephalography;Training;Feature extraction;Magnetic resonance imaging;Classification algorithms;Fast Fourier transforms;Testing","","1","","11","IEEE","1 Dec 2016","","","IEEE","IEEE Conferences"
"EEG-Based Classification of Olfactory Response to Pleasant Stimuli","N. I. Abbasi; R. Bose; A. Bezerianos; N. V. Thakor; A. Dragomir","Singapore Institute for Neurotechnology (SINAPSE), National University of Singapore (NUS); Singapore Institute for Neurotechnology (SINAPSE), National University of Singapore (NUS); Singapore Institute for Neurotechnology (SINAPSE), National University of Singapore (NUS); Singapore Institute for Neurotechnology (SINAPSE), National University of Singapore (NUS); Singapore Institute for Neurotechnology (SINAPSE), National University of Singapore (NUS)",2019 41st Annual International Conference of the IEEE Engineering in Medicine and Biology Society (EMBC),"7 Oct 2019","2019","","","5160","5163","Olfactory perception involves complex processing distributed along several cortical and sub-cortical regions in the brain. Although several studies have shown that the power spectra of the electroencephalography (EEG) contain information that can be used to differentiate between pleasant and unpleasant stimuli, there are still no studies which investigate whether EEG can be used to differentiate between the neural responses to olfactory stimuli of different levels of pleasantness. For this purpose, in the present study, local brain information within established frequency bands (θ, α and γ) has been used to devise discriminative features in a classification approach. A comparative study of four widely used classifiers is presented and SVM gives the best performance (accuracy = 75.71%). The results reveal that is it possible to objectively discriminate using EEG spectral features between fine levels of perceived pleasantness using the SVM-based classifier within a cross-validation procedure.","1558-4615","978-1-5386-1311-5","10.1109/EMBC.2019.8857673","","https://ieeexplore.ieee.org/stamp/stamp.jsp?arnumber=8857673","","Electroencephalography;Olfactory;Electrodes;Brain;Spectral analysis;Scalp;Time-frequency analysis","Brain;Electroencephalography;Emotions;Humans;Smell;Support Vector Machine","14","","26","IEEE","7 Oct 2019","","","IEEE","IEEE Conferences"
"Wearable EEG Entropy and Spectral Measures for Classification of Consumer Reward-based Evaluation of Odor Stimuli","M. S. Seet; A. V. Devarajan; J. J. L. Low; J. Hamano; M. Saba; N. V. Thakor; A. Dragomir","N.1 Institute for Health, National University of Singapore, Singapore; N.1 Institute for Health, National University of Singapore, Singapore; N.1 Institute for Health, National University of Singapore, Singapore; International Operations SA Singapore Branch, Procter & Gamble; International Operations SA Singapore Branch, Procter & Gamble; N.1 Institute for Health, National University of Singapore, Singapore; N.1 Institute for Health, National University of Singapore, Singapore",2021 43rd Annual International Conference of the IEEE Engineering in Medicine & Biology Society (EMBC),"9 Dec 2021","2021","","","5999","6002","Consumer neuroscience is a rapidly emerging field, with the ability to detect consumer attitudes and states via real-time passive technologies being highly valuable. While many studies have attempted to classify consumer emotions and perceived pleasantness of olfactory products, no known machine learning approach has yet been developed to directly predict consumer reward-based decision-making, which has greater behavioral relevance. In this proof-of-concept study, participants indicated their decision to have fragrance products repeated after fixed exposures to them. Single-trial power spectral density (PSD) and approximate entropy (ApEn) features were extracted from EEG signals recorded using a wearable device during fragrance exposures, and served as subject-independent inputs for 4 supervised learning algorithms (kNN, Linear-SVM, RBF- SVM, XGBoost). Using a cross-validation procedure, kNN yielded the best classification accuracy (77.6%) using both PSD and ApEn features. Acknowledging the challenging prospects of single-trial classification of high-order cognitive states especially with wearable EEG devices, this study is the first to demonstrate the viability of using sensor-level features towards practical objective prediction of consumer reward experience.","2694-0604","978-1-7281-1179-7","10.1109/EMBC46164.2021.9631055","","https://ieeexplore.ieee.org/stamp/stamp.jsp?arnumber=9631055","Consumer Neuroscience;Reward Decision-Making;EEG;Olfaction;Machine Learning","Support vector machines;Neuroscience;Wearable computers;Decision making;Olfactory;Machine learning;Feature extraction","Electroencephalography;Entropy;Humans;Odorants;Reward;Support Vector Machine;Wearable Electronic Devices","3","","19","IEEE","9 Dec 2021","","","IEEE","IEEE Conferences"
"A New Bionic Model and Its Application to Epileptic Electroencephalograph Recognition","J. Zhang; T. Tian; X. Liu; X. Shu; Q. Li","College of Information Science and Engineering, Hunan Normal University, Changsha, China; College of Information Science and Engineering, Hunan Normal University, Changsha, China; College of Information Science and Engineering, Hunan Normal University, Changsha, China; College of Information Science and Engineering, Hunan Normal University, Changsha, China; College of Information Science and Engineering, Hunan Normal University, Changsha, China","2018 14th International Conference on Natural Computation, Fuzzy Systems and Knowledge Discovery (ICNC-FSKD)","11 Apr 2019","2018","","","211","215","Imitating the nervous system is not only an effective method to construct artificial neural networks with better performance, but also a research hotspots. In this paper, a new bionic model stimulating olfactory neural systems, KIII model, is introduced and its performance is researched based on epileptic electroencephalograph (EEG) recognition. In section 2, KIII model is introduced briefly. The structure of the KIII model is similar to that of olfactory neural systems. The model of neurons is based on the real action of neurons with the stimulus and optimized according to mathematical optimization. In section 3, KIII model was used as a classifier and the performance of the KIII model was evaluated to identify epileptic EEG. In the first group of experiments, the features are extracted based on EMD and the recognition rate of the KIII model is over 91 % with few training times. In the second group of experiments, extracting the feature of EEG is unnecessary and the raw EEG signals are used as the input directly. The KIII model gives the better recognition rate over 96 %. Experimental results show that KIII model has remarkable characteristics: (1) KIII model can learn the pattern with few training times, which is different from general deep learning models; (2) KIII model can recognize raw signals without special feature-extracting process, which is similar with deep learning model; (3) the structure of KIII model is very similar to that of real olfactory neural systems, which is partly similar with deep learning model.","","978-1-5386-8097-1","10.1109/FSKD.2018.8687226","","https://ieeexplore.ieee.org/stamp/stamp.jsp?arnumber=8687226","Olfactory neural system;EEG recognition;KIII model","","","","","15","IEEE","11 Apr 2019","","","IEEE","IEEE Conferences"
"Integration of smell into the digital world","Y. Benazzouz; R. Boudour","Embedded Systems Laboratory, Badji Mokhtar University, Annaba, Algeria; Embedded Systems Laboratory, Badji Mokhtar University, Annaba, Algeria",2019 Third International Conference on Intelligent Computing in Data Sciences (ICDS),"27 Dec 2019","2019","","","1","6","This paper attempts to show that it is possible to develop smell based applications. The challenge is to infer correct smells from electroencephalography (EEG) signal, considering that a relationship between EEG data and smells was not admitted beforehand. One approach is to define a smells classifier using EEG sensing device, then it will be possible to integrate and use this information by applications or to share it over communication networks. In this work, a Deep learning classification model is explored to deduce correctly the type of odor the user is smelling. Primary results are encouraging at least for a small-scale experiment. The topic is still new and challenging and requires big reliable and accurate scientific data to achieve best performance.","","978-1-7281-0003-6","10.1109/ICDS47004.2019.8942368","","https://ieeexplore.ieee.org/stamp/stamp.jsp?arnumber=8942368","Smell;olfaction;Odor;EEG Signal;Deep learning;Artificial Intelligence;Neurosky","Electroencephalography;Brain modeling;Training;Deep learning;Data models;Software;Data collection","","1","","13","IEEE","27 Dec 2019","","","IEEE","IEEE Conferences"
"Electroencephalogram alterations during perception of pleasant and unpleasant odors","A. Yazdani; E. Kroupi; J. -M. Vesin; T. Ebrahimi","Multimedia Signal Processing Group (MMSPG), Institute of Electrical Engineering, Ecole Polytechnique Fédérale de Lausanne, Lausanne, Switzerland; Multimedia Signal Processing Group (MMSPG), Institute of Electrical Engineering, Ecole Polytechnique Fédérale de Lausanne, Lausanne, Switzerland; Applied Signal Processing Group (ASPG), Institute of Electrical Engineering, Ecole Polytechnique Fédérale de Lausanne, Lausanne, Switzerland; Multimedia Signal Processing Group (MMSPG), Institute of Electrical Engineering, Ecole Polytechnique Fédérale de Lausanne, Lausanne, Switzerland",2012 Fourth International Workshop on Quality of Multimedia Experience,"9 Aug 2012","2012","","","272","277","The olfactory system enables humans and many animals recognize and categorize different odors and can determine many behavioral and social reactions. For human beings, odor stimuli are highly associated with many processes such as emotions, attraction, mood, etc. One approach to understanding the olfaction is to monitor and analyze human brain activity during perception of odors. In this paper, we analyze electroencephalogram (EEG) of five participants during perception of unpleasant and pleasant odor stimuli. We identify the regions of the brain cortex that are active during discrimination of unpleasant and pleasant odor stimuli. We also show that, classification of EEG signals during perception of odors can reveal the pleasantness of the odor with relatively high accuracy.","","978-1-4673-0726-0","10.1109/QoMEX.2012.6263860","","https://ieeexplore.ieee.org/stamp/stamp.jsp?arnumber=6263860","Olfaction;Odor;EEG;Brain;Signal Processing","Electroencephalography;Olfactory;Brain;Electrodes;Humans;Feature extraction;Kernel","","25","","22","IEEE","9 Aug 2012","","","IEEE","IEEE Conferences"
"Improving the Classification of Olfactory Brain-Computer Interface Responses by Combining EEG and EBG Signals","H. Kasprzak; N. Niewińska; T. Komendziński; M. Otake-Matsuura; T. M. Rutkowski","Department of Cognitive Science, Nicolaus Copernicus University, Toruń, Poland; Department of Cognitive Science, Nicolaus Copernicus University, Toruń, Poland; Department of Cognitive Science, Nicolaus Copernicus University, Toruń, Poland; RIKEN Center for Advanced Intelligence Project (AIP), Tokyo, Japan; RIKEN Center for Advanced Intelligence Project (AIP), Tokyo, Japan",2024 46th Annual International Conference of the IEEE Engineering in Medicine and Biology Society (EMBC),"17 Dec 2024","2024","","","1","4","The sense of smell, or olfaction, can enhance brain-computer interfaces (BCIs). Different scents can be assigned to specific commands to allow users to interact with technology naturally, but challenges remain. Accurate odor delivery systems and robust algorithms for detecting and interpreting brain activity patterns are necessary. We propose combining electroencephalography (EEG) and electrobulbography (EBG) to improve classification accuracy. Our pilot study shows promising results for a new olfactory brain-computer interface (BCI) modality that combines common spatial pattern (CSP) filtration applied to EEG and EBG to classify responses to six scent stimuli in a classical oddball paradigm.","2694-0604","979-8-3503-7149-9","10.1109/EMBC53108.2024.10782826","Japan Science and Technology Agency; ","https://ieeexplore.ieee.org/stamp/stamp.jsp?arnumber=10782826","","Electrodes;Brain;Accuracy;Filtration;Olfactory;Noninvasive treatment;Electroencephalography;Brain-computer interfaces;Recording;Monitoring","Brain-Computer Interfaces;Electroencephalography;Humans;Algorithms;Signal Processing, Computer-Assisted;Smell;Male;Adult","","","14","IEEE","17 Dec 2024","","","IEEE","IEEE Conferences"
"A Publicly Available Multimodal Emotional Dataset Triggered by Both Videos and Odors","W. Teng; Z. Lv; X. Zhang","Anhui Province Key Laboratory of Multimodal Cognitive Computation, Anhui University, Hefei, China; Anhui Province Key Laboratory of Multimodal Cognitive Computation, Anhui University, Hefei, China; Anhui Province Key Laboratory of Multimodal Cognitive Computation, Anhui University, Hefei, China","2023 5th International Conference on Intelligent Control, Measurement and Signal Processing (ICMSP)","12 Jul 2023","2023","","","1024","1028","This study investigates multimodal emotion signal recognition by using odors as a stimulus material to explore the influence of the odor on human emotions. It is conducted in the context of traditional electroencephalography and electrooculography fusion for emotion recognition. We designed an experimental paradigm involving visual, auditory and olfactory senses, adding odors to traditional audiovisual medias to enhance emotion elicitation, and built a multimodal emotion dataset. The dataset contains electroencephalography and electrooculography data obtained from 15 subjects in video-odor stimulation and video-only stimulation experiments. 90 video clips and 10 odors were selected as stimulus materials. Besides, the Transformer classifier was adopted to classify the three categories of emotion, and give the average classification accuracy for the different features. Under differential entropy features, the multimodal average classification accuracy under video-odor stimulation was 3% higher than that under video-only stimulation. The results indicated that olfactory stimuli can be combined with video stimuli to enhance multimodal emotion recognition ability.","","979-8-3503-3603-0","10.1109/ICMSP58539.2023.10170849","","https://ieeexplore.ieee.org/stamp/stamp.jsp?arnumber=10170849","electroencephalography;electrooculography;emotio n recognition;odor-evoked datasets;multimodal fusion","Emotion recognition;Electrooculography;Visualization;Olfactory;Signal processing;Media;Transformers","","","","15","IEEE","12 Jul 2023","","","IEEE","IEEE Conferences"
