"Classification of EEG Signals Recorded While Imagining Odors with Effective Band Pass Filter Parameters","Ö. Aydemir; A. Naser; M. Öztürk","Elektrik-Elektronik Mühendisliği Bölümü, Karadeniz Teknik Üniversitesi, Trabzon, Türkiye; Elektrik-Elektronik Mühendisliği Bölümü, Karadeniz Teknik Üniversitesi, Trabzon, Türkiye; Elektrik-Elektronik Mühendisliği Bölümü, Karadeniz Teknik Üniversitesi, Trabzon, Türkiye",2020 28th Signal Processing and Communications Applications Conference (SIU),"7 Jan 2021","2020","","","1","4","Technological advances in medicine allow us to learn more about human physiology, anatomy, endocrinology and neurology. In this way, many diseases can be diagnosed early and treatment processes can be closely monitored. On the one hand, the advancing technology allows us to demonstrate how the human brain reacts to various environmental stimuli. In this study, electroencephalography (EEG) technique was used to record the reactions of the brain to the imagination of cloves and mint odors. The distinguishability of brain responses to these odors was tested using pixel means of gray-level images obtained from Burg-based color spectrogram images. By using pixel means as an attribute, a classification accuracy of 82.5% was obtained with k-nearest neighbor. The results showed that the EEG signals that can occur when the brain imagines different odors can be distinguished.","2165-0608","978-1-7281-7206-4","10.1109/SIU49456.2020.9302244","","https://ieeexplore.ieee.org/stamp/stamp.jsp?arnumber=9302244","odor;electroencephalogram;close;mint;classification;feature extraction","Electroencephalography;Sleep;Olfactory;Deep learning;Biosensors;Biomedical monitoring;Alzheimer's disease","","1","","","IEEE","7 Jan 2021","","","IEEE","IEEE Conferences"
"Recognition of hypoxia EEG with a preset confidence level based on EEG analysis","J. Zhang; G. Li; M. Hu; J. Li; Z. Luo","Nationa Laboratory of Industrial Control Techolology, University of Zhejiang, Hangzhou, China; Nationa Laboratory of Industrial Control Techolology, University of Zhejiang, Hangzhou, China; Department of Physics, University of Zhejiang, Hangzhou, China; PLA Airforce Sanitarium of Hangzhou, Hangzhou, China; Computer Learning Research Centre, University of London, Egham, Surrey, UK",2008 IEEE International Joint Conference on Neural Networks (IEEE World Congress on Computational Intelligence),"26 Sep 2008","2008","","","3005","3008","Though the olfactory model entitled KIII has been widely used to pattern recognition, it only can give bare prediction. Combining EM model with the transductive confidence machine, a novel method to recognize hypoxia electroencephalogram (EEG) with a preset confidence level is proposed in this paper. This method can make prediction with confidence measure rather than bare prediction. The experimental results of classifying normal and hypoxia EEGs show that the method can set confidence level in advance for every prediction to control the risk of error effectively.","2161-4407","978-1-4244-1820-6","10.1109/IJCNN.2008.4634221","","https://ieeexplore.ieee.org/stamp/stamp.jsp?arnumber=4634221","","Artificial neural networks;Joints","","6","","18","IEEE","26 Sep 2008","","","IEEE","IEEE Conferences"
"A brain-sensing fragrance diffuser for mental state regulation using electroencephalography","A. -Y. Zhuang; Y. C. Lin; S. -L. Yu; P. -C. Kuo","Department of Computer Science, National Tsing Hua University, Hsinchu, Taiwan; Department of Computer Science, National Tsing Hua University, Hsinchu, Taiwan; Department of Computer Science, National Tsing Hua University, Hsinchu, Taiwan; Department of Computer Science, National Tsing Hua University, Hsinchu, Taiwan",2021 IEEE 2nd International Conference on Human-Machine Systems (ICHMS),"27 Oct 2021","2021","","","1","6","Human brain studies have shown that olfactory perception can regulate emotion and attention networks and prevent depressed mental states. Fragrance diffusers have been used as the potential appliance to reconcile mental conditions and achieve stress relief in daily life. Although perceiving fragrances are a complicated and subjective experience, studies have shown that it is possible to reveal the personal preference of fragrance from brain activity measured by electroencephalography (EEG). Moreover, using EEG to detect neural/mental states and apply them to human-machine interfaces has also been investigated for years. Therefore, this pilot study has two aims: (1) to identify users’ preference for fragrances from EEG; (2) to develop a personalized fragrance diffuser, Aroma Box, which can detect three mental states from EEG when a user feels depressed, stressed, or drowsily and then release fragrances in real-time to help user recover from the abnormal states. To achieve this goal, we first extracted the features and built a classifier to identify the user’s preference for fragrances from EEG. Then we calculated the indicators of brain states based on the EEG frequency analysis. Based on our preliminary experimental results, we deployed our algorithms in an in-house developed diffuser with a consumer 32-channel EEG headset, which has been further implemented in a real-life working environment and evaluated its efficacy by two users.","","978-1-6654-0170-8","10.1109/ICHMS53169.2021.9582446","National Cheng Kung University; ","https://ieeexplore.ieee.org/stamp/stamp.jsp?arnumber=9582446","Olfactory perception;EEG;fragrance diffuser;brain-computer interface;human-computer interaction","Headphones;Electric potential;Conferences;Olfactory;Feature extraction;Electroencephalography;Regulation","","1","","26","IEEE","27 Oct 2021","","","IEEE","IEEE Conferences"
"Spectrum estimation of odor EEG responses with parametric-nonparametric spectral analysis methods","M. Şeker; M. Akin; M. S. Özerdem","Dicle Universitesi, Diyarbakir, TR; Dicle Universitesi, Diyarbakir, TR; Dicle Universitesi, Diyarbakir, TR",2018 26th Signal Processing and Communications Applications Conference (SIU),"9 Jul 2018","2018","","","1","4","It is known that external stimulus such as visual, auditory and odor have effect on brain activity. Effects of odor stimuli, which has complex structure, on central nerveous system is lack of knowledge in literature. The goal of proposed study is to show how pleasant-unpleasant odors effect brain waves by using spectral analysis methods and discriminating different odors through statistical methods and a classifier. The EEG dataset used in study was taken from 6 participants while their eyes are closed and 4 odor (2 pleasant-2unpleasant) stimulus were applied to them using 14 chanelled EMOTIV-EPOC headset. Discrete Wavelet Transform (DWT) was used to pre-processed signals obtained from embedded filters to extract more meaningful EEG sub-bands (delta-tetha-alpha-beta). First of all, power spectrum graphics of these sub-bands was drawn using Welch's method to see how pleasant-unpleasant odor EEGs behave. Then, spectrum coefficients were gained by help of parametric (Burg, Yule-Walker, Covariance, Modified Covariance) and non-parametric (Welch's) methods. Selected feature vectors from these coefficients were classified. Selected features are min, max value and standard deviation. k-NN was chosen for classification algorithm. Avarage power spectrum analysis showed that unpleasant odor EEG has higher values than pleasant one with respect to all sub-bands. Parametric methods gave better results to discriminate odor EEGs. Burg method has highest classification rate among others.","","978-1-5386-1501-0","10.1109/SIU.2018.8404229","","https://ieeexplore.ieee.org/stamp/stamp.jsp?arnumber=8404229","EMOTIV EPOC;odor;EEG;Welch;Burg;Yule Walker;Covariance;Modified Covariance;DWT","Electroencephalography;Spectral analysis;Brain modeling;Discrete wavelet transforms;Feature extraction;Time-frequency analysis;Visualization","","","","","IEEE","9 Jul 2018","","","IEEE","IEEE Conferences"
"Tempo-Spectral EEG Biomarkers for Odour Identification","M. Pandharipande; U. Tiwari; R. Chakraborty; S. K. Kopparapu","TCS Research, Tata Consultancy Services Limited, India; TCS Research, Tata Consultancy Services Limited, India; TCS Research, Tata Consultancy Services Limited, India; TCS Research, Tata Consultancy Services Limited, India",2023 45th Annual International Conference of the IEEE Engineering in Medicine & Biology Society (EMBC),"11 Dec 2023","2023","","","1","4","Different odours evoke different activity in the brain. Among the non-invasive methods, electroencephalogram (EEG) is the most widely used mode to measure brain activity. While there has been significant work around EEG signal analysis, studies in the area of EEG with odour as stimuli is nascent. In this paper, we experiment and study different EEG biomarkers with an aim to understand which biomarker shows promise for odour identification. We show, on a widely used and publicly available data-set, through a series of experiments that it is possible to get a Subject Dependent (SD) odour classification accuracy of over 90%, using a set of tempo-spectral EEG biomarkers. We further experiment with Subject Independent (SI) odour classification, which has not been addressed and show that the performance drops to under 50% for SI odour classification.Clinical Relevance – The study shows that the same odour evoke different brain responses from the subject.","2694-0604","979-8-3503-2447-1","10.1109/EMBC40787.2023.10340395","","https://ieeexplore.ieee.org/stamp/stamp.jsp?arnumber=10340395","","Brain;Biomarkers;Electroencephalography;Biology;Signal analysis","Odorants;Electroencephalography;Brain;Head","","","26","IEEE","11 Dec 2023","","","IEEE","IEEE Conferences"
"Identification of patients with de novo Parkinson's Disease from chemosensory EEG signals using ICEEMDAN domain Entropy Features","S. De; S. Pavuluri; A. K. Gupta","Institute of Radio Physics & Electronics, University of Calcutta, Kolkata, West Bengal, India; Department of Computer Science and Engineering, GVPCE, Visakhapatnam, Andhra Pradesh, India; HPC I&E Group, Centre for Development of Advanced Computing, Pune, Maharashtra, India",IEEE Sensors Letters,"","2025","PP","99","1","4","Parkinson's disease (PD) is a progressive neurodegenerative disorder that impairs motor and sensory functions, with early symptoms often involving olfactory dysfunction. Given the importance of detecting these early biomarkers for timely intervention, this letter proposes the novel use of chemosensory EEG for the early detection of PD, as it captures the brain's responses to olfactory stimuli, one of the primary sensory modalities affected by the disease. The proposed method employs an Improved Complete Ensemble Empirical Mode Decomposition with Adaptive Noise (ICEEMDAN) to decompose EEG signals into intrinsic mode functions (IMFs). Entropic features, including approximate entropy (AEn), sample entropy (SEn), and Rényi permutation entropy (RpEn), are extracted from these IMFs to identify distinguishing characteristics. These features are then evaluated using several machine learning classifiers. A comprehensive evaluation reveals that combining RpEn features with Least Squares Support Vector Machine (LS-SVM) classifier achieves optimal performance, with an accuracy of 96.47%, a precision of 96.14%, and a kappa score of 0.95.","2475-1472","","10.1109/LSENS.2025.3565312","","https://ieeexplore.ieee.org/stamp/stamp.jsp?arnumber=10979890","Parkinson's Disease;chemosensory EEG;olfactory dysfunction;ICEEMDAN;entropy features;machine learning","Electroencephalography;Entropy;Olfactory;Feature extraction;Accuracy;Diseases;Support vector machines;Random forests;Time series analysis;Complexity theory","","","","","IEEE","29 Apr 2025","","","IEEE","IEEE Early Access Articles"
"EEG-fMRI features analysis in odorants stimuli with citralva and 2-mercaptoethanol","W. -S. Kang; H. -O. Kwon; C. Moon; J. K. Kim; S. Yun; S. Kim","IT-Convergence Division, Daegu Gyeongbuk Institute of Science & Technology (DGIST); IT-Convergence Division, Daegu Gyeongbuk Institute of Science & Technology (DGIST); Department of Brain Science, DGIST, Daegu, Republic of Korea; Konkuk University Medical Center, Seoul, Republic of Korea; IT-Convergence Division, Daegu Gyeongbuk Institute of Science & Technology (DGIST); Department of Brain Science, DGIST, Daegu, Republic of Korea","SENSORS, 2013 IEEE","19 Dec 2013","2013","","","1","4","In this paper, we presented the undefined patterns of EEG and fMRI features in the stimuli of citralva and 2-mercaptoethanol which be used as a standard in olfaction stimuli to the selected subjects. We placed the 4 channel-based EEG electrodes. In addition, we tried to analyze fMRI data of one trial for each stimulus to improve the EEG drawbacks. As a result of EEG-fMRI data analysis, we confirmed that the odorant (citralva) occurred to decrease the average relative power (ARP) values of alpha, beta and gamma bands when compared with the stable and rest sessions and the odorant (2-mercaptoethanol) occurred to increase the ARP values of alpha, beta and gamma bands. fMRI data on citralva and 2-mercaptoethanol stimuli showed that the particular brain area was deactivated in citralva stimuli and activated in 2-mercaptoethanol. It showed that meaningful EEG signals can be measured with just a few electrodes.","1930-0395","978-1-4673-4642-9","10.1109/ICSENS.2013.6688436","","https://ieeexplore.ieee.org/stamp/stamp.jsp?arnumber=6688436","","Electroencephalography;Electrodes;Protocols;Feature extraction;Data acquisition;Materials;Olfactory","","1","","10","IEEE","19 Dec 2013","","","IEEE","IEEE Conferences"
"An Investigation of Olfactory-Enhanced Video on EEG-Based Emotion Recognition","M. Wu; W. Teng; C. Fan; S. Pei; P. Li; Z. Lv","Anhui Province Key Laboratory of Multimodal Cognitive Computation and the School of Computer Science and Technology, Anhui University, Hefei, China; Anhui Province Key Laboratory of Multimodal Cognitive Computation and the School of Computer Science and Technology, Anhui University, Hefei, China; Anhui Province Key Laboratory of Multimodal Cognitive Computation and the School of Computer Science and Technology, Anhui University, Hefei, China; Anhui Province Key Laboratory of Multimodal Cognitive Computation and the School of Computer Science and Technology, Anhui University, Hefei, China; Anhui Province Key Laboratory of Multimodal Cognitive Computation and the School of Computer Science and Technology, Anhui University, Hefei, China; Anhui Province Key Laboratory of Multimodal Cognitive Computation and the School of Computer Science and Technology, Anhui University, Hefei, China",IEEE Transactions on Neural Systems and Rehabilitation Engineering,"13 Mar 2023","2023","31","","1602","1613","Collecting emotional physiological signals is significant in building affective Human-Computer Interactions (HCI). However, how to evoke subjects’ emotions efficiently in EEG-related emotional experiments is still a challenge. In this work, we developed a novel experimental paradigm that allows odors dynamically participate in different stages of video-evoked emotions, to investigate the efficiency of olfactory-enhanced videos in inducing subjects’ emotions; According to the period that the odors participated in, the stimuli were divided into four patterns, i.e., the olfactory-enhanced video in early/later stimulus periods (OVEP/OVLP), and the traditional videos in early/later stimulus periods (TVEP/TVLP). The differential entropy (DE) feature and four classifiers were employed to test the efficiency of emotion recognition. The best average accuracies of the OVEP, OVLP, TVEP, and TVLP were 50.54%, 51.49%, 40.22%, and 57.55%, respectively. The experimental results indicated that the OVEP significantly outperformed the TVEP on classification performance, while there was no significant difference between the OVLP and TVLP. Besides, olfactory-enhanced videos achieved higher efficiency in evoking negative emotions than traditional videos. Moreover, we found that the neural patterns in response to emotions under different stimulus methods were stable, and for Fp1, FP2, and F7, there existed significant differences in whether adopt the odors.","1558-0210","","10.1109/TNSRE.2023.3253866","National Natural Science Foundation of China (NSFC)(grant numbers:61972437); Excellent Youth Foundation of Anhui Scientific Committee(grant numbers:2208085J05); National Key Research and Development Program of China(grant numbers:2021ZD0201502); Special Fund for Key Program of Science and Technology of Anhui Province(grant numbers:202203a07020008); Natural Science Foundation of Anhui Province(grant numbers:2108085MF207); Open Research Projects of Zhejiang Laboratory(grant numbers:2021KH0AB06); Open Projects Program of National Laboratory of Pattern Recognition(grant numbers:202200014); Open Fund Project of Key Laboratory of Civil Aviation Flight Technology and Flight Safety(grant numbers:FZ2022KF15); Cloud Ginger XR-1; ","https://ieeexplore.ieee.org/stamp/stamp.jsp?arnumber=10063978","Electroencephalogram (EEG);emotion recognition;human–computer interface (HCI);olfactory-enhanced video;neural pattern","Electroencephalography;Emotion recognition;Brain;Human computer interaction;Physiology;Visualization;Olfactory","Humans;Electroencephalography;Emotions;Recognition, Psychology;Entropy","30","","50","CCBYNCND","8 Mar 2023","","","IEEE","IEEE Journals"
"Olfactory Recognition Based on EEG Gamma-Band Activity","O. Aydemir","Karadeniz Technical University, Department of Electrical and Electronics Engineering, 61080, Trabzon, Turkey",Neural Computation,"23 May 2017","2017","29","6","1667","1680","There are various kinds of brain monitoring techniques, including local field potential, near-infrared spectroscopy, magnetic resonance imaging (MRI), positron emission tomography, functional MRI, electroencephalography (EEG), and magnetoencephalography. Among those techniques, EEG is the most widely used one due to its portability, low setup cost, and noninvasiveness. Apart from other advantages, EEG signals also help to evaluate the ability of the smelling organ. In such studies, EEG signals, which are recorded during smelling, are analyzed to determine the subject lacks any smelling ability or to measure the response of the brain. The main idea of this study is to show the emotional difference in EEG signals during perception of valerian, lotus flower, cheese, and rosewater odors by the EEG gamma wave. The proposed method was applied to the EEG signals, which were taken from five healthy subjects in the conditions of eyes open and eyes closed at the Swiss Federal Institute of Technology. In order to represent the signals, we extracted features from the gamma band of the EEG trials by continuous wavelet transform with the selection of Morlet as a wavelet function. Then the -nearest neighbor algorithm was implemented as the classifier for recognizing the EEG trials as valerian, lotus flower, cheese, and rosewater. We achieved an average classification accuracy rate of 87.50% with the 4.3 standard deviation value for the subjects in eyes-open condition and an average classification accuracy rate of 94.12% with the 2.9 standard deviation value for the subjects in eyes-closed condition. The results prove that the proposed continuous wavelet transform–based feature extraction method has great potential to classify the EEG signals recorded during smelling of the present odors. It has been also established that gamma-band activity of the brain is highly associated with olfaction.","0899-7667","","10.1162/NECO_a_00966","","https://ieeexplore.ieee.org/stamp/stamp.jsp?arnumber=7932904","","","","14","","","Traditional","23 May 2017","","","MIT Press","MIT Press Journals"
"Motor imagery classification for brain-computer interfaces through a chaotic neural network","D. R. de Moraes Piazentin; J. L. G. Rosa","Department of Computer Science, University of Sao, Paulo, Brazil; BioCom - Bioinspired Computing Laboratory, Department of Computer Science, University of Sao Paulo, Brazil",2014 International Joint Conference on Neural Networks (IJCNN),"4 Sep 2014","2014","","","4103","4108","In this paper, we propose to enhance the detection of control states in online brain-computer interfaces (BCI) with the use of the biologically inspired K-set neural network. This neural network was initially built to model brain waves of small sets of neurons in the brain and later showed a great capability of encoding complex and noisy data into oscillation patterns. We apply the K-set network to classification of motor imagery, a type of mental state very useful for BCI applications. Experimental results show that the network can work efficiently in this task and thus provide better control for BCI applications.","2161-4407","978-1-4799-1484-5","10.1109/IJCNN.2014.6889636","","https://ieeexplore.ieee.org/stamp/stamp.jsp?arnumber=6889636","","Electroencephalography;Neurons;Sociology;Statistics;Biological neural networks;Brain modeling;Oscillators","","4","","22","IEEE","4 Sep 2014","","","IEEE","IEEE Conferences"
"Olfaction recognition by EEG analysis using differential evolution induced Hopfield neural net","A. Saha; A. Konar; P. Rakshit; A. L. Ralescu; A. K. Nagar","Department of Electronics and Telecommunication Engineering, Jadavpur University, Kolkata, India; Department of Electronics and Telecommunication Engineering, Jadavpur University, Kolkata, India; Department of Electronics and Telecommunication Engineering, Jadavpur University, Kolkata, India; Computer Science department, University of Cincinnati, Cincinnati, USA; Department of Math and Computer Science, Liverpool Hope University, Liverpool, UK",The 2013 International Joint Conference on Neural Networks (IJCNN),"9 Jan 2014","2013","","","1","8","The paper proposes a novel approach to recognize smell stimuli from the electroencephalogram (EEG) signals acquired during the period of inhalation. The main contribution of the paper lies in feature selection by an evolutionary algorithm and pattern classification by Differential Evolution induced Hopfield neural network. One additional merit of the work lies in data point reduction by Principal component analysis. Experiments undertaken on 25 subjects with 10 smell stimuli indicate that the proposed scheme of feature selection, data point reduction and classification outperforms the traditional approach by a wide margin. Experimental results confirm that the smell stimuli excites the pre frontal lobe of the human brain and is responsible for a special type of brain rhythms (EEG signal) in alpha-band, theta-band and delta-band.","2161-4407","978-1-4673-6129-3","10.1109/IJCNN.2013.6706874","","https://ieeexplore.ieee.org/stamp/stamp.jsp?arnumber=6706874","","Electroencephalography;Vectors;Feature extraction;Hopfield neural networks;Neurons;Principal component analysis;Educational institutions","","21","","27","IEEE","9 Jan 2014","","","IEEE","IEEE Conferences"
"Comparison of Different Data Augmentation Methods With an Experimental EEG Dataset","E. Ş. Sadik; H. M. SaraoĞlu; S. Canbaz Kabay; M. Tosun; G. AkdaĞ","Dept. of Electrical Electronics Eng., Kütahya Dumlupınar University, Faculty of Engineering, Turkey; Dept. of Electrical Electronics Eng., Kütahya Dumlupınar University, Faculty of Engineering, Turkey; Dept. Of Neurology, Kütahya Health Sciences University, Faculty Of Medicine, Turkey; Dept. of Electrical Electronics Eng., Kütahya Dumlupmar University, Simav Faculty of Technology, Turkey; Dept. Of Neurology, Kütahya Health Sciences University, Faculty Of Medicine, Turkey",2021 13th International Conference on Electrical and Electronics Engineering (ELECO),"21 Jan 2022","2021","","","289","292","Electroencephalogram (EEG) signals are small amplitude, complex and high noise components. For the correct interpretation of these signals, powerful noise removal, advanced signal processing, data multiplexing and feature extraction methods are needed. Within the scope of this study, spectral features of EEG signals recorded while 30 volunteers were sniffing four different essential odors (lavender, rosemary, rose and peppermint) within the framework of an experimental procedure were analyzed separately, without data multiplexing and using four different data multiplexing methods such as Amplyfing all time data, Time shifting, Time Stretching and Gaussian Noise Addition were tried to be classified and success rates were compared. As a result of the data obtained, the highest performance was found with the amplifying all-time data augmentation method, and four different odor data could be classified with 88.9% accuracy with CART and 97.0% accuracy with KNN.","","978-605-01-1437-9","10.23919/ELECO54474.2021.9677865","","https://ieeexplore.ieee.org/stamp/stamp.jsp?arnumber=9677865","","Multiplexing;Gaussian noise;Signal processing;Feature extraction;Electroencephalography","","1","","23","","21 Jan 2022","","","IEEE","IEEE Conferences"
